<?xml version="1.0" encoding="UTF-8"?>
<!DOCTYPE Rules SYSTEM "../rules.dtd">
    <Unit id="catapult" category="unitcategory_siege">
      <Name>Catapult</Name>
      <Name lang="de_DE">Katapult</Name>
      <Description lang="de_DE">
        <p>Das Basismodell 'Catabilly' zum selber zusammenbauen, unschlagbar gÃ¼nstig.</p> 
      </Description>
      <Description lang="en_US">
        <p>The catapults take the cake in every intense battle because of their devastating damage.</p>
      </Description>
      <Cost id="resource_stone" round="true">2</Cost>  
      <Cost id="resource_wood" round="true">10</Cost>    
      <Cost id="resource_fur" round="true">4</Cost>    
      <ProductionTime shortenable="true">300</ProductionTime> 
	 <Requirement id="building_workshop" min_level="11" />	  
      <Velocity>0.7</Velocity>
      <ActionPoints>4</ActionPoints>
      <Initiative>16</Initiative>
      <Attack>15</Attack>
      <CriticalDamage chance="0.01">2</CriticalDamage>
      <Armor>0</Armor>
      <!--needs special ability: destroy semi-random building level-->
      <Overrunnable>true</Overrunnable>
      <Hitpoints>90</Hitpoints>
      <Effectiveness category="unitcategory_infantry">0.2</Effectiveness>
      <Effectiveness category="unitcategory_cavalry">0.1</Effectiveness>
      <Effectiveness category="unitcategory_artillery">0.2</Effectiveness>
      <Effectiveness category="unitcategory_siege">1</Effectiveness>     
    </Unit>