<?xml version="1.0" encoding="UTF-8"?>
<!DOCTYPE Rules SYSTEM "../rules.dtd">

    <Unit id="light_cavalry" category="unitcategory_cavalry">
      <Name>Ostrich Riders</Name>
      <Name lang="de_DE">Straußenreiter</Name>
  <Flavour lang="en_US">
    <p>Kills opposing units.</p>
  </Flavour>
  <Flavour lang="de_DE">
    <p>Kämpft gegen andere Einheiten.</p>
  </Flavour>
      <Description lang="de_DE">
        <p>Strauße sind nicht nur lecker sondern auch gute und schnelle Kämpfer. Die Straußenreiter sind äußerst schnell, dafür aber nur schwach gepanzert.</p> 
      </Description>
      <Description lang="en_US">
        <p>Ostrichs are not only delicious but also excellent and fast animals to be used in combats. Ostrich riders are very quick, but only lightly armored.</p>
      </Description>
      <Cost id="resource_stone" round="true">2</Cost>  
      <Cost id="resource_wood" round="true">10</Cost>    
      <Cost id="resource_fur" round="true">4</Cost>    
      <ProductionTime shortenable="true">300</ProductionTime>  
  	  <Velocity>1.5</Velocity>
      <ActionPoints>5</ActionPoints>
      <Initiative>26</Initiative>
      <Attack>16</Attack>
      <CriticalDamage chance="0.01">10</CriticalDamage>
      <Armor>3</Armor>
      <Overrunnable>true</Overrunnable>
      <Hitpoints>95</Hitpoints>
      <Effectiveness category="unitcategory_infantry">0.3</Effectiveness>
      <Effectiveness category="unitcategory_cavalry">0.75</Effectiveness>
      <Effectiveness category="unitcategory_artillery">1</Effectiveness>
      <Effectiveness category="unitcategory_siege">0.4</Effectiveness>   
    </Unit>